"comm","size","type","members"
1,58,"real","ACTB  AFF3  ANXA6  AP1S2  ARIH1  ATXN1  CFL2  CKAP4  DNAJA3  DPYSL2  EEF1A1  ELL2  ENO3  ERRFI1  FLNB  GMFB  GPC1  GTF3C4  HOXA5  IGBP1  KIAA1244  KRT17  LACOSAMIDE  LRP1B  MAP2  MARCKS  MED8  MPRIP  MTF2  NDOR1  NIN  NR5A2  PHACTR2  PRKDC  PTPRE  RANBP9  RBFOX1  RQCD1  RUVBL1  SAMD4A  SARS  SASH1  SEC23A  SF1126  SIP1  SLIT2  SORBS1  TFAP2A  TMEM16K  TMOD3  TOB1  TRPV4  UACA  UBR2  WASF3  WIPF1  YWHAE  YWHAZ"
2,36,"real","ABCIXIMAB  AS1409  C1QA  CFD  CILENGITIDE  COL2A1  COL6A2  COLLAGENASE_CLOSTRIDIUM_HISTOLYTICUM  EPTIFIBATIDE  F200  FN1  GANTOFIBAN  GLPG0187  HMOX2  IGLL1  ISL1  ITGA1  ITGA2B  ITGA3  ITGA5  JSM_6427  KIAA0232  MEP1A  PKD1  PLAT  PPHLN1  RABIF  RAP2C  SAN_300  SPARC  STANNSOPORFIN  TGFBI  TGM2  TIROFIBAN  TRANEXAMIC_ACID  UROKINASE"
3,9,"real","BAG5  BCL2L2  CASP2  FEM1C  HIVEP2  LGALS3BP  NAVITOCLAX__ABT_263  PPM1F  TCEB1"
4,50,"real","ACVR1B  ADCK1  AMUVATINIB  ANAPC7  ANK3  ARID4B  AXITINIB  BCAP31  BMP2K  BRYOSTATIN  BRYOSTATIN_1  C12orf4  CALML3  CRKL  CSNK1G3  DASATINIB  DOK1  ENMD_2076  FEZ1  FEZ2  GRAP  HIPK1  HIPK3  IMATINIB  INGENOL_MEBUTATE  KHDRBS1  KIT  LENVATINIB  LIMK2  LINIFANIB  MAP4K5  MAPK7  MASITINIB  MCFD2  METTL1  METTL2B  MOTESANIB  MSN  PHKG2  PICALM  PRKCQ  PRKCZ  RPS6KA3  SELPLG  SORAFENIB  SUNITINIB  TBK1  VATALANIB  XL820  XL999"
5,9,"real","ATG3  CLASP1  GOLGA1  NADK  NUP54  NUP98  RAB11FIP2  RASSF8  WDFY3"
6,8,"real","ACTB1003  APOE  EXEBRYL_1  MAPT  NUDT4  RPS6KB1  SSU72  XL418"
7,41,"real","ALCLOMETASONE  AMCINONIDE  BECLOMETHASONE  BECLOMETHASONE_DIPROPIONATE  BETAMETHASONE  BUDESONIDE  CICLESONIDE  CLOBETASOL  CLOCORTOLONE  CORT_108297  DESONIDE  DESOXIMETASONE  DEXAMETHASONE  DIFLORASONE  DIFLUPREDNATE  FLUMETHASONE_PIVALATE  FLUNISOLIDE  FLUOCINOLONE_ACETONIDE  FLUOCINONIDE  FLUOROMETHOLONE  FLURANDRENOLIDE  FLUTICASONE  FLUTICASONE_FUROATE  FLUTICASONE_PROPIONATE  HALOBETASOL_PROPIONATE  HE3286  HYDROCORTAMATE  KB3305  LOTEPREDNOL_ETABONATE  MEDRYSONE  METHYLPREDNISOLONE  MIFEPRISTONE  MOMETASONE  NR3C1  PARAMETHASONE  PMI_001  PREDNICARBATE  PREDNISOLONE  PREDNISONE  RIMEXOLONE  TRIAMCINOLONE"
8,17,"real","IFNAR1  INTERFERON_ALFACON_1  INTERFERON_ALFA_2A__RECOMBINANT  INTERFERON_ALFA_2B__RECOMBINANT  INTERFERON_ALFA_N1  INTERFERON_ALFA_N3  INTERFERON_ALPHA  INTERFERON_ALPHA_2B  INTERFERON_BETA  INTERFERON_BETA_1A  INTERFERON_BETA_1B  MODIFIED_IFN_ALPHA  MODIFIED_IFN_BETA  PEGINTERFERON_ALFA_2A  PEG_INTERFERON_ALFACON_1  RECOMBINANT_INTERFERON_ALFA_2B  SIFALIMUMAB"
9,6,"real","BCL11A  HNF1A  KIF13B  POU2F3  PPAP2B  UTP6"
10,7,"real","ARSENIC_TRIOXIDE  ATF3  CCND1  FOSL2  JUN  TSC22D3  T_5224"
11,3,"real","ADRBK1  GIT2  PEBP1"
12,4,"real","AC_100_DENTONIN  BGC20_1531  DINOPROSTONE  PTGER4"
13,3,"real","EPS8  MRPL20  UBAP1"
14,3,"real","ARHGDIB  ARHGDIG  RHOBTB1"
15,3,"real","MDK  PTPRZ1  TNR"
16,3,"real","PROC  SODIUM_TETRADECYL_SULFATE  THBD"
17,3,"real","LESTAURTINIB  NTRK2  PYM50028"
18,113,"LeftOvers","8-MAR  AGFG1  ALG1  ARHGAP6  ASF1A  ATL2  ATP11C  B3GALTL  BCL2L7P1  BHLHE41  C11orf87  C16orf72  C16orf93  C21orf91  CCNJ  CDH11  CDK17  CNEP1R1  COL4A3BP  CPA5  CSMD3  CXorf23  CYB5B  DELTAEF1  DENENICOKIN  DENND5B  DNAJC3  DPY19L1  DUSP1  EDEM3  EIF5A2  ELMOD2  FAM122C  FAM134B  FAM160B1  FAM86A  FAT3  FBXO33  FGF1  FOXF1  GATA4  GOLGA7  GPM6A  GPR107  GPR158  GUK1  HDHD2  HECTD2  HMBOX1  HN1  HOXA11  IGSF10  IL21R  KIAA1432  LHFP  MBOAT2  MGAT5  MIEF1  MMD  MMGT1  MYCBP2  NFIA  NOVA1  OSTM1  PCMTD1  PDIK1L  PDS5B  PENTOSAN_POLYSULFATE  PHACTR3  PHF21B  PHTF2  PIKFYVE  PLCL1  POLK  PPFIA1  PPP1R18  PRSS36  PTPN21  RECK  RFTN2  RIMKLB  RNF169  RNF2  SESN1  SGIP1  SLC35B4  SLC6A1  SLITRK1  SNN  SULF1  SYDE1  SYNJ1  TBC1D25  TBX18  TFAP4  TIAGABINE  TMEFF2  TRIM33  TROVE2  TSC22D2  VASH2  WAPAL  WAVE3  WHSC1  YPEL2  ZCCHC24  ZEB1  ZEB2  ZEB4  ZFPM2  ZNF322  ZNF532  ZSWIM6"
